{
  "schema_version": "0.2.8",
  "snapshot_id": "snapshot:current",
  "observed_at": "2026-08-23T00:00:00+00:00",
  "backend_id": "backend-beta",
  "benchmark_id": "benchmark:reference",
  "benchmark_version": "1.0",
  "agent_config_id": "agent-config:stable",
  "measurement_contract": {"unit":"interaction_depth","reliability_p":0.9,"scope_id":"scope:reference","assessment_method":"monotone_binomial_pava_v1"},
  "family_suites": {
    "code": {
      "schema_version":"0.2.7","calibration_id":"family:code:current","calibrated_at":"2026-08-23T00:00:00+00:00",
      "measurement_contract":{"unit":"interaction_depth","reliability_p":0.9,"scope_id":"scope:reference","assessment_method":"monotone_binomial_pava_v1"},
      "evidence_confidence_p":0.9,"minimums":{"min_distinct_depths":4,"min_total_trials":40,"min_trials_per_depth":10},
      "subjects":{
        "autonomy":[{"depth":4,"trials":10,"successes":10,"evidence_refs":["evidence:family:code:current:autonomy:4"]},{"depth":8,"trials":10,"successes":10,"evidence_refs":["evidence:family:code:current:autonomy:8"]},{"depth":12,"trials":10,"successes":10,"evidence_refs":["evidence:family:code:current:autonomy:12"]},{"depth":16,"trials":10,"successes":7,"evidence_refs":["evidence:family:code:current:autonomy:16"]}],
        "governance":[{"depth":3,"trials":10,"successes":10,"evidence_refs":["evidence:family:code:current:governance:3"]},{"depth":6,"trials":10,"successes":10,"evidence_refs":["evidence:family:code:current:governance:6"]},{"depth":9,"trials":10,"successes":10,"evidence_refs":["evidence:family:code:current:governance:9"]},{"depth":12,"trials":10,"successes":7,"evidence_refs":["evidence:family:code:current:governance:12"]}]
      }
    },
    "research": {
      "schema_version":"0.2.7","calibration_id":"family:research:current","calibrated_at":"2026-08-23T00:00:00+00:00",
      "measurement_contract":{"unit":"interaction_depth","reliability_p":0.9,"scope_id":"scope:reference","assessment_method":"monotone_binomial_pava_v1"},
      "evidence_confidence_p":0.9,"minimums":{"min_distinct_depths":4,"min_total_trials":160,"min_trials_per_depth":40},
      "subjects":{
        "autonomy":[{"depth":2,"trials":40,"successes":40,"evidence_refs":["evidence:family:research:current:autonomy:2"]},{"depth":4,"trials":40,"successes":40,"evidence_refs":["evidence:family:research:current:autonomy:4"]},{"depth":6,"trials":40,"successes":38,"evidence_refs":["evidence:family:research:current:autonomy:6"]},{"depth":8,"trials":40,"successes":28,"evidence_refs":["evidence:family:research:current:autonomy:8"]}],
        "governance":[{"depth":1,"trials":40,"successes":40,"evidence_refs":["evidence:family:research:current:governance:1"]},{"depth":3,"trials":40,"successes":40,"evidence_refs":["evidence:family:research:current:governance:3"]},{"depth":5,"trials":40,"successes":38,"evidence_refs":["evidence:family:research:current:governance:5"]},{"depth":7,"trials":40,"successes":28,"evidence_refs":["evidence:family:research:current:governance:7"]}]
      }
    }
  }
}
